{
  "operation_id": "validate_json_schema_with_python_jsonschema",
  "operation_name": "Validate JSON Schema with python-jsonschema",
  "operation_type": "VALIDATE_JSON_SCHEMA",
  "status": "CONTRACT_READY",
  "phase_created": "PHASE_84",
  "related_material_id": "mat_python_jsonschema_001",
  "related_quarantine_card_path": "materials/quarantine/mat_python_jsonschema_001/MATERIAL_CARD.json",
  "purpose": "Define a future controlled operation boundary for validating JSON instances against JSON Schema using python-jsonschema after later smoke-test and wrapper proof steps.",
  "input_contract": {
    "schema_path": {
      "type": "string",
      "required": true,
      "description": "Future path to a JSON Schema input file. PHASE84 does not require this file to exist."
    },
    "instance_path": {
      "type": "string",
      "required": true,
      "description": "Future path to a JSON instance input file. PHASE84 does not require this file to exist."
    },
    "options": {
      "type": "object",
      "required": false,
      "allowed_future_keys": [
        "schema_dialect",
        "format_checking",
        "error_format"
      ]
    },
    "working_directory_policy": {
      "must_be_repo_relative": true,
      "no_global_write": true,
      "no_external_fetch": true
    }
  },
  "output_contract": {
    "status": "PASS_FAIL_ERROR",
    "valid": "boolean",
    "errors": "array",
    "warnings": "array",
    "tool_name": "python-jsonschema",
    "tool_version": "record_required_later",
    "proof_path": "proofs/operations/future_validate_json_schema_with_python_jsonschema.json"
  },
  "allowed_reads": [
    "future declared schema_path",
    "future declared instance_path",
    "operations/contracts/validate_json_schema_with_python_jsonschema.contract.json",
    "materials/quarantine/mat_python_jsonschema_001/MATERIAL_CARD.json"
  ],
  "allowed_writes": [
    "future operation-local report path",
    "future operation-local proof path"
  ],
  "forbidden_actions": [
    "install_tool",
    "fetch_repo",
    "run_tool_in_phase84",
    "mutate_catalog",
    "mutate_policy",
    "mutate_quarantine_card",
    "mark_material_trusted",
    "mark_operation_trusted",
    "use_in_external_agent",
    "modify_global_environment"
  ],
  "execution_mode": "NO_EXECUTION",
  "risk_level": "LOW",
  "smoke_test_plan": {
    "status": "SMOKE_TEST_PENDING",
    "test_name": "python_jsonschema_validation_smoke_test",
    "objective": "Later prove python-jsonschema can validate a passing fixture and reject a failing fixture inside a controlled boundary.",
    "required_fixture_files": [
      "future fixtures/schema_valid.json",
      "future fixtures/instance_valid.json",
      "future fixtures/instance_invalid.json"
    ],
    "expected_success_case": "valid fixture returns valid=true with no errors",
    "expected_failure_case": "invalid fixture returns valid=false with structured errors",
    "isolation_requirement": "No global install, no network fetch, no writes outside operation output paths.",
    "proof_required": true
  },
  "proof_requirements": {
    "command_log": true,
    "input_fixture_hashes": true,
    "output_report": true,
    "no_global_mutation_evidence": true,
    "tool_version_record": true,
    "exit_code": true,
    "validator_pass": true
  },
  "rollback_notes": "Remove this contract and registry summary if PHASE84 acceptance fails. No catalog, policy, quarantine, wrapper, or tool rollback should be required.",
  "owner_approval_required": false,
  "created_at": "2026-05-29T00:00:00Z",
  "next_allowed_step": "PHASE85_FIRST_SMOKE_INSTALL_TRIAL_V1"
}
